t,h,label,relatedness_score,sentence_h_en,sentence_t_en
العجين ينشره رجل,رجل ينثر العجين,1,4.8,A man is spreading dough,Dough is being spread by a man
كلب كبير وكلب أبيض صغير يلعبان معًا,يسير كلب كبير وكلب أبيض صغير أمام بعضهما البعض,0,3.9,A big dog and a small white dog are walking past each other,A big dog and a small white dog are playing together
والفهد يركض بسرعة وراء فريسته.,والفهد يركض بسرعة وراء فريسته.,1,4.6,A cheetah is quickly running behind its prey.,The cheetah is running quickly behind its prey
الفتاة ذات الرداء الأزرق تستمتع بوقتها على الأرجوحة,فتاة باللون الأزرق تنزلق على شريحة خضراء,0,2.835,A girl in blue is sliding down a green slide,The young girl in blue is having fun on a swing
يتم عزف على الناي من قبل رجل,ليس هناك رجل يعزف  على الغيتار بصوت عال,0,1.8,There is no man playing the guitar loudly,A flute is being played by a man
رجل يتحدث على المنصة,رجل ألقى كلمة على المنصة,1,4.8,A man is making a speech on a podium,A man is speaking on a podium
امرأة تقطع الطماطم,لا يوجد امرأة ترقص بالقرب من النار,0,1.3,There is no woman dancing near a fire,A woman is cutting a tomato
راكب الأمواج يتكئ على لوح تزلج على الماء,راكب أمواج يتكئ على لوح تزلج على الماء,1,5.0,A surfer is leaning on a surfboard,The surfer is leaning on a surfboard
مجموعة من الأشخاص يحملون مشروبات ويشيرون إلى الكاميرا,رجل يعزف على الغيتار الكهربائي,0,1.0,A man is playing an electric guitar,A group of people is holding drinks and pointing at the camera
فتاة صغيرة ترتدي قميصًا ورديًا تركض تحت شجرة في الصحراء,الفتاة الصغيرة ذات القميص الوردي تركض تحت شجرة في الصحراء,1,4.9,The little girl in a pink shirt is running under a tree in the desert,A little girl in a pink shirt is running under a tree in the desert
يسير شخصان مع سلال محملة وبطانيات,شخصان يجلسان مع سلال محملة وبطانيات,0,4.2,Two people are sitting with laden baskets and blankets,Two people are walking with laden baskets and blankets
يقف الرجل الذي يرتدي سروالًا قصيرًا مخططًا ونظارة شمسية بالقرب من رجل يرتدي قميصًا أبيض ونظارة شمسية,يرقص الرجل الأسود ذو العضلات القوية والرجل الذي يقف خلفه يرتدي خرزًا أخضر,0,2.265,The muscular black man is dancing and the man behind him is wearing green beads,The shirtless man in striped shorts and sunglasses is standing near a man in a white shirt and sunglasses
يقف الرجل في مسطح مائي بالقرب من شلال,يقف الرجل في بحيرة بالقرب من شلال,1,4.7,The man is standing in a lake near a waterfall,The man is standing in a body of water near a waterfall
يتكئ طفلان على حافة صدئة,رجل يرتدي زيًا أسود يرتدي قناعًا أسود متقنًا,0,3.3,A man dressed in black is wearing an elaborate black mask,A man is holding a mask in his raised hand
الرجل الطويل يشعل النار في الكاميرات,شخص يحرق بعض الكاميرات بشعلة,0,3.8,A person is burning some cameras with a blow torch,The tall person is setting fire to the cameras
قطار لعبة يصطدم بسيارة لعبة,قطار لعبة يصطدم بعنف بسيارة لعبة,1,4.5,A toy train is violently striking a toy car,A toy train is striking a toy car
نحلة تتشبث بزهرة صفراء,النحلة الصغيرة تهبط على باقة من الزهور الصفراء,0,3.6,The small bee is landing on a bunch of yellow flowers,A bee is clinging to a yellow flower
ثلاثة أولاد يمشون على الصخور بمحاذاة النهر,ثلاثة أولاد يتأرجحون على طول النهر,0,2.9,Three boys are rocking the walk along the river,The men in brown shorts are walking on the rocks beside a river
رجل يقفز على الترامبولين,رجل يقوم به الظهر تقلب على الترامبولين,1,4.3,A man is doing back flips on a trampoline,A man is jumping on a trampoline
رجل يركب دراجة نارية,رجل يركب دراجة نارية عن طريق المدينة,1,4.4,A man is riding a motorcycle through the town,A man is riding a motorcycle
لا يوجد امرأة تقطع الطماطم ,امرأةأنها قشرت  البطاطا,0,2.4,A woman is peeling a potato,There is no woman slicing a tomato
شخصان يركبان دراجة,شخصان يتوقفان على دراجة نارية,1,2.9,Two people are stopping on a motorcycle,Two people are riding a bike
لا يتم تقشير البطاطا من قبل امرأة,ويجري تقشير البطاطا من قبل امرأة,2,3.2,The potato is being peeled by a woman,The potato isn't being peeled by a woman
امرأة أنها خلطت البيض,المرأة الجائعة تأكل,0,2.5,The hungry woman is eating,A woman is mixing eggs
بعض الرجال تتقاتل ,رجلان لا يتقاتلون,0,4.0,Two men are not fighting,Some men are fighting
طفلة صغيرة تعزف على البيانو الكبير على المسرح,فتاة صغيرة تعزف على البيانو الكبير على المسرح,1,4.8,"A girl, who is little, is playing a grand piano on stage",A little girl is playing a grand piano on stage
رجل يتزلج على الجليد يقفز في الهواء,لا يوجد شخص يرتدي سروالًا رماديًا ومحمولًا على لوح التزلج,0,2.7,There is no person wearing grey pants who is airborne on a snowboard,A snowboarding man is jumping through the air
لا أحد يطعم حيوانًا,يتم العزف على البيانو من قبل شخص,0,1.0,The piano is being played by someone,Nobody is feeding an animal
فالطفل يستيقظ,فالطفل يستيقظ ببطء,1,4.5,A child is slowly waking up,A child is waking up
فتاة تنط الحبل على الرصيف,فتاة تقفز على الحبل على رصيف بالقرب من مرآب للسيارات,1,4.3,A girl is jumping rope on a sidewalk near a parking garage,A girl is skipping rope on a sidewalk
شخصان يمشيان كلبين يرتديان معاطف ذهبية في الثلج,بعض الناس في الثلج يرتدون ملابس تمويه,0,2.7,"Some people are in the snow, wearing clothes that provide camouflage",Two people are walking two dogs with golden coats in the snow
الشخص يقوم بتقطيع  الخضروات,شخص ما قطع الطماطم,1,4.1,Someone is slicing a tomato,The person is slicing a vegetable
فرقة تعزف على خشبة المسرح,فرقة تعزف على خشبة المسرح,1,5.0,A band is playing on a stage,A band is playing onstage
 لا يتحدث الببغاء,الببغاء يتحدث في الميكروفون,2,3.5,The parrot is talking into the microphone,There is no parrot speaking
رجل على متن قارب أمام الغروب,رجل يقف على متن قارب أمام غروب الشمس قرب العلم,1,4.1,A man is standing on a boat in front of the sunset near a flag,A man is on a boat in front of the sunset
رجلان ينظران إلى الخارج والآخر يحمل منظارًا,امرأتان تقفان معًا والأخرى تنظر من خلال منظار,0,2.7,Two women are standing together and one is looking through binoculars,Two men are looking out and one is holding binoculars
كلبان يلعبان على شاطئ رملي,كلب أسود يقترب من كلب ذهبي على شاطئ مغطى بالحصى,0,3.1,A black dog is approaching a golden dog on pebbly beach,Two dogs are playing on a sandy beach
كلب ثور يمسح القرد,القرد يفرش كلب الثور,0,3.9,The monkey is brushing a bull dog,A bull dog is brushing the monkey
صبي تحت مظلة يحتجزه والده وهو يرتدي معطفًا مصبوغًا باللون الأزرق,طفل يمر بعالم جديد,0,1.8,A child is experiencing a new world,A boy under an umbrella is being held by his father who is wearing a coat dyed in blue
الشخص يرسم,شخص ما يرسم شخصًا,1,4.0,Someone is drawing a person,The person is drawing
قرد ركل شخصاً,ليس هناك قرد ركل شخص,2,4.3,There is no monkey kicking a person,A monkey is kicking a person
صبيان يرقدان في الماء بالقرب من الشاطئ,صبيان يرقدان في المحيط بالقرب من الشاطئ,1,4.4,Two boys are laying in the ocean close to the beach,Two boys are laying in the water close to the beach
رجل يرتدي زي رسمي يمسك الميكروفون ويبدأ الغناء,عائلة تشتري شيئا من آلة البيع,0,1.0,A family is buying something at the vending machine,A man in a suit is standing at a microphone and singing
شخص يقرأ البريد الإلكتروني,رجل يقرأ البريد الإلكتروني,1,4.6,A man is reading the email,Someone is reading the email
صبي صغير يعزف على آلة النفخ,طفل يرمي آلة,0,2.8,A kid is throwing away an instrument,A young boy is playing a wind instrument
طفل يحمل بخاخ ماء يضحك و يرشه بالماء الأولاد الآخرون,ليس هناك طفل يحمل بخاخ ماء يضحك,2,4.0,There is no child holding a water gun or getting sprayed with water,A laughing child is holding a water gun and getting sprayed with water
رجل يفتح علبة تحتوي على سماعات رأس,رجل يغني أغنية  ويعزف على الغيتار,0,1.2,A man is singing a song and playing the guitar,A man is opening a package that contains headphones
امرأة جالسة بجانب كلب وتبتسم لفتاة صغيرة جالسة على الرصيف,امرأة جالسة بجانب كلب وتبتسم لفتاة صغيرة تجلس على الرصيف,1,4.8,A woman is crouching down next to a dog and is smiling at a young girl sitting on the sidewalk,A woman is crouching down next to a dog and is smiling at a little girl sitting on the sidewalk
يشاهد الحشد سيارتين من سيارات السباق تغادران خط البداية,الجمهور لا يشاهد سيارتين من سيارات السباق تغادران خط البداية,2,3.5,The crowd is not watching two racing cars that are leaving the starting line,The crowd is watching two racing cars that are leaving the starting line
امرأة تقلي العميق الغذاء,ليس هناك امرأة تقلي الغذاء,2,3.1,There is no woman deep frying food,A woman is deep frying food
بعض القطط يأكلون,رجل يأكل بالقرب من القطط,0,2.9,A man is eating near the kittens,Some kittens are eating
امرأة قطعت بصلة,لم تقطع المرأة البصل,2,3.1,There is no woman slicing an onion,A woman is slicing an onion
امرأة ترقص بالقرب من النار, رجل قطع الطماطم,0,1.1,A man is cutting a tomato,A woman is dancing near a fire
رجل يصطاد سمكة,رجل يطلق سراح سمكة,0,4.0,A man is freeing a fish,A man is catching a fish
يركب صبي صغير يرتدي خوذة دراجة على الطريق,صبي صغير يرتدي خوذة يركب دراجة على الطريق,1,4.9,A young boy in a helmet is riding a bike on the road,A bike is ridden on the road by a young boy in a helmet 
طفلان وامرأة يلعبان في صالة ألعاب,طفلان ورجل يلعبان الألعاب في صالة ألعاب,0,3.7,Two kids and a man are playing games at an arcade,Two kids and a woman are playing games at an arcade
ليس هناك امرأة قطعت البصل,وقالت امرأة أنها قطعت البصل,2,3.5,A woman is cutting an onion,There is no woman cutting an onion
صبي يرتدي شورتًا أحمر يقفز في بركة تجديف,صبي يبدو شابًا ويرتدي ملابس سباحة حمراء ، يقفز في حمام سباحة أزرق للأطفال,0,4.0,"A boy, who looks young and is wearing a red swimsuit, is jumping into a blue kiddies pool",A boy wearing red shorts is jumping into a paddling pool
امرأة تضع المكياج على وجهها,امرأة تضع المكياج على عينيها,1,4.3,A woman is putting on eyeshadow,The woman is putting make-up on
مجموعة من عربات التزلج على الجليد تصطف على الطريق,مجموعة من عربات التزلج على الجليد تصطف في الشارع,1,4.9,A group of rollerbladers is lining up on the street,A group of rollerbladers is lining up on the road
امرأة تعزف على الكمان,امرأة تعزف على الناي,1,4.8,A woman is playing the flute,The flute is being played by a woman
الشخص لا يطير في الهواء على دراجة,الشخص يطير في الهواء على دراجة,2,4.2,The person is flying through the air on a bicycle,The person is not flying through the air on a bicycle
فتاة شرقية شابة تقف فوق الحشد وتلعب بالمروحة,فتاة غربية صغيرة تقف فوق الحشد وتلعب بدولاب الهواء,0,4.2,A young occidental girl is standing above the crowd and is playing with a pinwheel,A young oriental girl is standing above the crowd and is playing with a pinwheel
شخص يخفق البيض بقوة في وعاء,امرأة تضرب بيضتين في وعاء وتستخدم خفاقة مصنوعة من الأسلاك,1,4.8,An interview is being granted by the man,The man is granting an interview
رجل يجلس في حقل,الشخص يجلس ويرتدي قبعة العشب,0,3.3,A person is sitting and wearing a grass hat,A man is sitting in a field
القط يشرب الحليب جائعًا,رجل بلا مأوى يرفع لافتة ويتسول من أجل المال,0,1.0,A homeless man is holding up a sign and is begging for money,The cat is hungrily drinking milk
رجلان ينظران إلى الخارج ويمسك أحدهما بمنظار,يقف رجلان معًا والآخر ينظر من خلال منظار,1,4.0,Two men are standing together and one is looking through binoculars,Two men are looking out and binoculars are being held by one of them
لا يوجد كلب فروي وأسود في الفناء الخلفي يحمل سلة في فمه.,كلب ذو فرو أسود في فناء خلفي يحمل سلة في فمه,2,3.7,A dog which is furry and black is in a back yard and is carrying a basket in its mouth,There is no dog which is furry and black in a back yard carrying a basket in its mouth.
الرجال يحزمون الحقائب في صندوق سيارة,الرجال لا يضعون حقائب في صندوق سيارة,2,3.1,The men are not putting suitcases into the trunk of a car ,The men are packing suitcases into the trunk of a car
كلب بجوار شجرة ، ربما شجرة صنوبر ، يعض ​​دلوًا,كلب ذو فرو أسود في فناء خلفي يحمل سلة في فمه,0,2.785,A dog which is furry and black is in a back yard and is carrying a basket in its mouth,"A dog next to a tree, which is probably a pine, is biting a bucket"
يقفز كلب بني كبير فوق حاجز أحمر,قطة بنية كبيرة تقفز فوق حاجز أحمر,0,3.4,A large brown cat is jumping over a red hurdle,A large brown dog is jumping over a red hurdle
طفل يعزف على الغيتار,امرأة تعزف على الغيتار الكهربائي,0,3.0,A woman is playing an electric guitar,A kid is playing guitar
طفلان يرتديان ملابس بيضاء وملابس واقية حمراء يتشاجران على حصيرة,صبيان يرتديان ملابس بيضاء وملابس واقية حمراء يتجادلان على حصيرة,1,4.3,Two boys in white outfits and red protective gear are sparring on a mat,Two children in white outfits and red protective gear are sparring on a mat
الرجال يقاتلون بقبضة في حلقة,الرجال يقاتلون بقبضاتهم في حلقة,1,4.8,The men are fighting with their fists in a ring,The men are fist fighting in a ring
شخص يغني  واللعب على الغيتار,رجل يغني ويعزف على الغيتار ,1,4.9,A man is singing and playing a guitar,A person is singing and playing a guitar
شخص يرتدي سترة حمراء ويمسك بيرة,المرأة ترتدي سترة حمراء وتحمل كأسًا أمام الرجل بقميص أبيض,0,3.7,The woman is wearing a red jacket and holding a glass in front of the man in a white t-shirt,A person is wearing a red jacket and carefully holding a beer
امرأة  لم تقطع البصل,امرأة  لم تقطع الثوم,0,3.4,A woman is slicing garlic,A woman is not slicing an onion
وليس هناك رجل يكتب على لوحة المفاتيح الإلكترونية,رجل يعزف على الفلوت,0,2.3,A man is playing a flute,There is no man playing an electronic keyboard
يقف كلب كبير وكلب صغير بجوار طاولة المطبخ ويقومان بالشم,كلب أسود وكلب صغير أبيض وأسود ينظران إلى منضدة مطبخ,0,4.2,A black dog and a small white and black dog are looking up at a kitchen countertop,A large dog and a small dog are standing next to the kitchen counter and are sniffing
شخص  يقطع البصل,شخص  يقطع البصل الأحمر,1,4.6,A person is chopping a red onion,A person is chopping an onion
امرأة تضع على ماكياج,ليس هناك فتاة تضع ماكياج على وجهها,0,4.0,There is no girl applying makeup to her face,A woman is putting on makeup
رجل واحد يتسلق الجرف بحبل,الشخص يتسلق  على الصخور بحبل,1,4.1,"A person is climbing a rock with a rope, which is pink",One man is climbing the cliff with a rope
رجل يكتب على لوحة المفاتيح مع أنفه,ليس هناك رجل يعزف  على البيانو بأنفه,2,2.9,There is no man playing the piano with his nose,A man is playing the keyboard with his nose
تقشر السيدة البطاطس,امرأة تقشر حبة بطاطس,1,4.8,A woman is peeling a potato,The potato is being peeled by the lady
صبي يقفز من على منصة ويقف صبيان آخران ويحدقان فيه,ثلاثة أولاد يقفزون من على منصة,0,3.7,Three boys are jumping off a platform,A boy is jumping off a platform and two other boys are standing and staring at him
القطة الجاثمة على الطاولة تنظر بفضول من النافذة,قطة بيضاء تطفو على خزانة خشبية صغيرة تنظر خارج النافذة,1,4.0,A white cat perched on a small wooden cabinet is looking outside the window,The cat perched on the table is looking curiously out the window
يرتدي الصبي ذو الوجه السمين نظارات داكنة,يرتدي الصبي ذو الوجه السمين نظارة شمسية,1,4.5,A chubby faced boy is wearing sunglasses,A chubby faced boy is wearing dark glasses
مجموعة من الرجال تقاتل,بعض الرجال تتقاتل ,1,4.5,Some men are fighting,A group of men is fighting
ويلعب الأطفال في الهواء الطلق بالقرب من  رجل مبتسم,ويلعب الصبية الصغار في الهواء الطلق و رجل يبتسم يقف قريبا منهم,1,4.7,The young boys are playing outdoors and the man is smiling nearby,The kids are playing outdoors near a man with a smile
رجل يدق على طبل,رجل يدق على طبل,1,4.6,A man is playing the drum,A man is practicing the drum
شخص ما يضع المكونات في مقلاة,شخص يقطع الثوم إلى قطع بسكين,0,2.8,A person is slicing garlic into pieces with a knife,Someone is putting ingredients into a wok
أربعة أطفال يلعبون  في الحديقة,أربعة أطفال يلعبون  في صالة الألعاب الرياضية,0,3.8,Four children are doing backbends in the gym,Four children are doing backbends in the park
شخصان بالغان يقفان على دراجة بخارية في حقل من الزهور,يقف شخصان بالغان على دراجة بخارية في حقل من الزهور الصفراء,1,4.5,Two adults are standing on a scooter in a field of yellow flowers,Two adults are standing on a scooter in a field of flowers
رجل يقود سيارة,وليس هناك رجل يقود سيارة,2,4.4,There is no man driving a car,A man is driving a car
رجل يقترب بعض الشخصيات,رجل يقترب على لوحة,0,3.5,A man is drawing on a board,A man is drawing some figures
كلب بني يركض خلف كلب أسود على شاطئ صخري,كلبان يلعبان في الغابة,0,2.3,Two dogs are playing in a forest,A brown dog is running after a black dog on a rocky shore
أربعة رياضيين مع شخص في ملعب  مزدحم,أربعة رياضيين مع رجل في ملعب  مزدحم,1,4.7,Four athletes are with a man in a crowded stadium,Four athletes are with a person in a crowded stadium
ليس هناك رجل يعزف  على الغيتار,شخص يعزف على البوق ,0,2.5,A person is playing a trumpet,There is no man playing the guitar
كلب أبيض كبير يقفز في الثلج,يقفز كلب أبيض كبير في الهواء فوق منطقة مغطاة بالثلوج,1,4.2,A large white dog is jumping in the air over an area covered by snow,A large white dog is jumping up in the snow
السيدة تقطع اللحم,السيدة لا تكسر بيضة للخلاط,0,2.335,The lady isn't cracking an egg for the mixer,The lady is slicing up the meat
وكانت طائرة تطير,وكانت طائرة لا تطير,2,2.4,A jet is not flying,A jet is flying
رجل ينظر إلى المسافة والناس يسيرون بين المباني خلفهم,رجل أسود يسير بجوار مبنى في مدينة كبيرة,0,3.3,A black man is walking next to a building in a big city,A man is looking into the distance and people is walking between buildings behind
ثلاثة أطفال يقفزون في الأوراق,ثلاثة أطفال يجلسون في الأوراق,0,3.8,Three kids are sitting in the leaves,Three kids are jumping in the leaves
رجل البصل قطع,رجل البصل تشريح,1,4.9,A man is slicing onions,A man is cutting onions
رجل يأكل بعض الطعام,لا يوجد انسان يأكل الطعام,2,4.1,There is no man eating food,A man is eating some food
مجموعة من الطلاب يرتدون الزي الرسمي يستمعون بانتباه في مقدمة الفصل,لا يوجد فصل دراسي مليء بالطلاب الذين ينظرون في نفس الاتجاه داخل هيكل من الخيزران,0,2.6,There is no classroom full of students looking in the same direction inside a bamboo structure,A group of students in uniforms is listening attentively at the front of the class
لا يوجد قطع الطماطم امرأة,امرأة تلتقط علبة,0,1.4,A woman is picking a can,There is no woman slicing a tomato
طفلان يدفعان بجانب تمساح في مسبح قابل للنفخ,طفلان يدفعان تمساحًا قابل للنفخ في حوض سباحة,0,4.1,Two kids are playing in a swimming pool with a green colored crocodile float,An inflatable crocodile is being pushed by two kids in a pool
الرجل على خشبة المسرح يغني في الميكروفون,رجل يقف اما الميكروفون ويغني,1,4.3,A man in a suit is standing at a microphone and singing,The man on stage is singing into the microphone
الناس لا يمشون عبر جسر حبل فوق مجرى صخري,يمشي ثلاثة أشخاص عبر حبل وجسر خشبي فوق نهر,0,3.285,Three people are walking across a rope and wood bridge over a river,People are not walking across a rope bridge over a rocky stream
ليس هناك امرأة تمارس الرياضة,امرأة تمارس الرياضة,2,3.5,A woman is exercising,There is no woman exercising
يقوم الفرسان بإبطاء خيولهم في الميدان ، وهو أخضر تمامًا,الفرسان هم خيول السباق في الميدان ، وهو أخضر بالكامل,0,4.2,"The Jockeys are racing horses on the field, which is completely green","The Jockeys are slowing down their horses on the field, which is completely green"
يتنافس فريقان في مباراة كرة قدم,لاعب يرمي الكرة,0,2.9,A player is throwing the ball,Two teams are competing in a football match
امرأة  لم تقطع الطماطم,رجل يلتقط علبة,0,1.4,A man is picking a can,A woman is slicing a tomato
الولد الصغير يغني  يعزف على الغيتار,إن الطفل لايعزف على الغيتار,0,3.6,A baby is not playing a guitar,The little boy is singing and playing the guitar
امرأة تعزف على الكمان,رجل يعزف على البيانو ,0,2.5,A man is playing the piano,A woman is playing the violin
