t,h,label,relatedness_score,sentence_h_en,sentence_t_en
فتاة لديها بقع سوداء وبرتقالية على الخدين,لا توجد فتاة ذات بقع سوداء وبرتقالية على الخدين,2,3.8,There is no girl with black and orange patches on the cheeks,A girl has black and orange patches on the cheeks
امرأة ترمي بيضتين لراقصة البريك,امرأة أنها كسرت اثنين من البيض في وعاء,0,2.0,A woman is breaking two eggs in a bowl,A woman is bowling two eggs to a break dancer 
حيوان ينظر حوله,كلب ينظر إلى منضدة المتجر,0,3.3,A dog is looking at a store counter,An animal is looking around
شخص يرتدي سترة حمراء ويحمل جعة,المرأة لا ترتدي سترة حمراء ولا تحمل كأسًا أمام الرجل بقميص أبيض,0,2.4,The woman is not wearing a red jacket and is not holding a glass in front of the man in a white t-shirt,A person is wearing a red jacket and holding a beer
اثنان من مصارعى السومو يتقاتلون,اثنان من رعاة السومو يتقاتلون,1,4.0,Two sumo ringers are fighting,Two sumo wrestlers are fighting
امرأة يركب دراجة نارية للمياه,امرأة يركب دراجة نارية المياه,1,4.1,A woman is riding a water scooter,A woman is riding a scooter for water
رجل يضع جزرة,رجل يقطع جزرة بسكين,0,2.8,A man is slicing a carrot with a knife,A man is putting away a carrot
كلب أبيض وأسود يركض في الهواء الطلق,الكلب الأسود والأبيض يجري في ساحة خضراء,1,4.4,The black and white dog is running in a green yard,A black and white dog is running outdoors
شخص يرتدي قبعة سوداء يصل إلى صندوق,رجل يرتدي قبعة سوداء يبحث عن صندوق,1,4.6,A man in a black hat is reaching for a box,A person in a black hat is reaching for a box
شخص يرقص,رجل يرقص,1,4.5,A man is dancing,A person is dancing
يتم وضع الطفل في سلة المهملات من قبل امرأة,لا يوجد أي طفل يتم وضع في سلة المهملات من قبل امرأة,2,3.8,There is no baby being put into a trash can by a woman,The baby is being put into a trash can by a woman
لا يوجد أي فهد يركض بسرعة وراء فريسته,الفهد  يطارد فريسته عبر حقل,2,3.6,A cheetah is chasing its prey across a field,There is no cheetah quickly running behind its prey
رجل يقفز في الهواء في منطقة حرجية,رجل يقفز في الهواء في الخشب,0,4.3,A guy is leaping into the air in wood,A guy is leaping into the air in a wooded area
الرجل يتحدث على الهاتف,الرجل لا يتكلم على الهاتف,2,3.7,The man is not talking on the phone,The man is talking on the telephone
يقوم شخص بأداء الألعاب البهلوانية على دراجة نارية,رجل على دراجة نارية يركب عجلة واحدة,1,4.1,A man on a motorcycle is riding on one wheel,A person is performing acrobatics on a motorcycle
الولد يخوض المحيط الأزرق,الصبي يجلس بالقرب من المحيط الأزرق,2,3.2,The boy is sitting near the blue ocean,The boy is wading through the blue ocean
لا يوجد كلب أليف يقف على الضفة وينظر إلى كلب بني آخر في البركة,الكلب الأسمر يراقب كلبًا بنيًا يسبح في بركة,0,2.5,The tan dog is watching a brown dog that is swimming in a pond,There is no pet dog standing on the bank and looking at another brown dog in the pond
رجل يقف امام الميكروفون ويغني,الرجل على خشبة المسرح لا يغني في الميكروفون,0,3.3,The man on stage isn't singing into the microphone,A man in a suit is standing at a microphone and singing
يسير الناس عبر جسر حبل فوق جدول صخري,يعبر الناس جسرًا من الحبال فوق مجرى صخري,1,4.9,People are crossing a rope bridge over a rocky stream,People are walking across a rope bridge over a rocky stream
رجل يصطاد سمكة,امرأة تخلع سمكة بعناية,0,1.4,A woman is carefully deboning a fish,A man is catching a fish
الكلب يستريح في غرفة المعيشة,الكلب يستريح في الحديقة,2,3.7,The dog is having a rest in the park,The dog is having a rest in the living room
قطة سوداء وقطة صغيرة بيضاء وسوداء تبحثان عن سطح عمل المطبخ,كلب أسود وكلب صغير أبيض وأسود ينظران إلى منضدة مطبخ,0,2.2,A black dog and a small white and black dog are looking up at a kitchen countertop,A black cat and a small white and black cat are looking up at a kitchen countertop
متزلج على الجليد يؤدي في الهواء الطلق على حلبة تزلج مليئة بالناس ,وهناك الكثير من الناس في حديقة للتزلج على الجليد,0,3.5,A lot of people are in an ice skating park,An ice skater is outdoors performing on a rink full of people
رجل و مرأة يمشيان,الرجل والمرأة لا يسيرون,2,2.8,The man and woman are not walking,The man and woman are walking
ليس هناك رجل فتح الباب,رجل يفتح باب,2,3.6,A man is opening a door,There is no man opening a door
يلعب كلب أبيض وأسود كرة طائرة مكسورة,كلب أبيض وأسود يلعب مع الطبق الطائر في حقل بني,0,3.6,A black and white dog is playing with a frisbee in a brown field,A black and white dog is playing with a broken volleyball
سباح شاب يجلس في ثوب السباحة وينتظر السباق التالي,طفل جالس يرتدي ملابس السباحة,0,3.7,A kid is sitting wearing swim gear,A young swimmer is sitting in a bathing suit and waiting for the next race
فتاة تقف بجانب فتحة نافورة,صبي يقف بجانب فتحة نافورة,0,2.9,A boy is standing next to the opening of a fountain,A girl is standing next to the opening of a fountain
الشخص لا تركب الخيل ,رجل يركب الحصان,0,3.7,A man is riding a horse,The person is not riding the horse
ليس هناك امرأة قطعت البطاطا,امرأة قطعت بصلة,0,2.4,A woman is slicing an onion,There is no woman cutting a potato
شخص ما يعزف على الجيتار,رجل يعزف على الغيتار,1,4.6,A man is playing the guitar,Someone is playing the guitar
امرأتان يرتدون الأبيض والأسود يجلسون على مقاعد البدلاء,امرأتان يرتدون الأبيض والأسود والاسترخاء على مقاعد البدلاء,0,4.2,Two women dressed in white and black are relaxing on a bench,Two women dressed in white and black are sitting on a bench
رجل دهن بالزبد قطعة من الخبز,رجل دهن بالزبد قطعة من الخبز,1,4.6,A man is buttering a piece of bread,A man is buttering a slice of bread
الكنغر  التقاط امرأة,المرأة تلتقط الكنغر,2,3.8,The woman is picking up the kangaroo,The kangaroo is picking up the woman
الصبي يتسلق  على جدار مصنوع من الصخور,والطفل في الداخل يشاهد برنامج حول بعض المتسلقين الشباب على الجدار الصخري.,0,3.4,A child is indoors watching a program about some young climbers on a rock wall.,The young boy is climbing the wall made of rock
شخص يضع المكونات في وعاء,ويجري حاليا وضع الخضار في وعاء من قبل رجل,1,4.0,Vegetables are being put into a pot by a man,Someone is pouring ingredients into a pot
رجل يقطع حذاءه بالسيف,شخص يقطع إصبع حذاء جلدي فارغ بالسيف,1,4.0,A person is severing the toe of an empty leather boot with a sword,A man is cutting a boot with a sword
يركض كلب أسود وأبيض بفرح على العشب,واحد كلب أبيض وأسود واحد واحد يجلسون جنبا إلى جنب على العشب,0,4.115,One white dog and one black one are sitting side by side on the grass,A black and a white dog are joyfully running on the grass
وقال الرجل أنه ركب الخيل ,وقال الرجل أنه لم يركب الخيل ,2,4.1,A guy is not riding a horse,A guy is riding a horse
كلب يطارد ذيل حيوان في العشب,كلب يمشي بعيدًا عن ذيل حيوان في العشب,0,3.1,A dog is walking away from the tail of an animal in the grass,A dog is chasing the tail of an animal in the grass
رجلان يسبحان في المياه العميقة,رجلان يمشيان في الماء,0,3.9,Two men are walking through the water,Two men are swimming in deep water
رجل يتسلق  على الحبل,رجل يتسلق الحبل بحذر,1,4.5,A man is carefully climbing a rope,A man is climbing a rope
صبي يعزف على البيانو,شخص يغني ويعزف على الجيتار,0,3.1,A person is singing and playing a guitar,A boy is playing a piano
الرجل يعزف على الناي,رجل يعزف على الغيتار,0,2.5,A man is strumming the guitar,The man is playing the flute
شخص يعزف على البيانو,ليس هناك شخص يعزف على البيانو,2,3.7,There is no person playing a piano,A person is playing a piano
رجل واحد يجلس بثبات على الكرسي,الفتاة الصغيرة تمشط شعرها في شكل ذيل حصان.,0,3.5,"The girl, who is little, is combing her hair into a pony tail.","The girl, who is little, is ruffling her hair"
الرجل  يرتدي قميص رمادي مصبوغ يجلس على صخرة أمام شلال,رجل يرتدي  كنزة رمادية يجلس على صخرة أمام الشلال,1,4.9,The man in a grey t-shirt is sitting on a rock in front of the waterfall,The man in a t-shirt dyed grey is sitting on a rock in front of a waterfall
قرد صغير يمشي في الماء,قرد يخوض في نهر,0,4.3,A monkey is wading through a river,A small monkey is walking through water
شخص يضع الطعام في الماء,امرأة يغلي الشعرية في الماء,1,3.6,A woman is boiling noodles in water,Someone is stirring food in the water
طفل وشخص بالغ يتبعهما وحيد القرن,وحيد القرن الصغير يتجول حول قلم مع والدته,0,2.8,A baby rhino is walking around a pen with its mother,A baby and an adult are being followed by a rhino
يلعب كلب كبير وكلب صغير يرتدي معطفًا أبيض معًا,كلب كبير وكلب أبيض صغير يلعبان معًا,1,4.5,A big dog and a small white dog are playing together,A big dog and a small dog with a white coat are playing together
رجل يركب دراجة هوائية,قرد يقود دراجة,0,3.4,A bike is being ridden over a monkey,A man is riding a bicycle
يقف رجل بشارب أبيض على شرفة وينظر إلى الطريق بالأسفل,يضع الرجل الكاميرا بعيدًا ويبتعد عن الشاطئ,0,1.6,The man is putting away the camera and walks away from the beach,A man with a white moustache is standing on a balcony and is looking at the road below
شخص ما لا يضع المكونات في مقلاة,شخص ما يضع المكونات في مقلاة,2,3.4,Someone is putting ingredients into a wok,Someone is not putting ingredients into a wok
مجموعة الرجال يلعبون الرجبي في حقل موحل,مجموعة الرجال يلعبون بالطين في ملعب الرجبي,0,3.4,The bunch of men are playing with the mud on a rugby field,The bunch of men are playing rugby on a muddy field
العديد من لاعبي القفز يسبحون في الماء,السباحون يتسابقون في بحيرة,0,3.165,Swimmers are racing in a lake,Several jumpers are swimming in the water
امرأتان يرتدون الأبيض والأسود يجلسون على مقاعد البدلاء,شخصين يجلسون على مقعد في حديقة في يوم حار,0,3.6,Two people are sitting on a park bench on a hot day,Two women dressed in white and black are sitting on a bench
امرأة تقطع,امرأة تقوم بقطع الجزرة إلى شرائح,1,4.9,A woman is slicing a carrot,A woman is cutting a carrot
الرجل ذو القبعة الأرجواني لا يشغل كاميرا تصنع مقاطع فيديو,رجل بكاميرا يدرس الموضوع,0,3.2,A man with a camera is studying the subject,The man in the purple hat isn't operating a camera that makes videos
امرأة تظهر كلبًا بشعر قصير جدًا في عرض للكلاب,امرأة تسير مع زوج من الكلاب,0,2.4,A woman is marching with a pair of dogs,A woman is showing a dog with very short hair at a dog show
حصان وراكبه يقفزان فوق حاجز,حصان بلا راكب يسقط فوق عقبة,0,3.1,A horse with no rider is falling over a hurdle,A horse and its rider are leaping over a barrier
كلب صغير أبيض وأسود يحمل عصا وهو يسبح,كلب يجلب قطعة من الخشب من ماء نقي جدًا,0,3.9,A dog is fetching a piece of wood out of very clear water,A small black and white dog is carrying a stick and is swimming
الصبي لم يقطع العشب  بالمقص ,الصبي  قطع العشب بالمقص ,2,3.8,The boy is cutting the grass by the curb with scissors,The boy is not cutting the grass by the curb with scissors
شخص يطوي قطعة من الورق,شخص يطوي ملاءة,0,3.5,A person is folding a sheet,A person is folding a piece of paper
رجل وامرأة في الخارج ويرتديان قمصانًا فاتحة اللون,امرأة تنظر بفضول إلى الرجل,0,1.6,A woman is looking curiously at a man,A man and a woman are outside and are wearing light colored shirts
رجل يتكئ على عمود ويحيط به الناس,رجل شرق أوسطي يقف أمام عمود إنارة بالقرب من أشخاص آخرين,1,3.7,A middle eastern man is standing against a lamp post near to other people,A man is leaning against a pole and is surrounded by people
طفل يتحدث,صبي يقول كلمة,1,3.9,A boy is saying a word,A child is talking
رجل يكتب على لوحة المفاتيح,الشخص لا يكتب على لوحة المفاتيح,2,2.6,A person is not playing the keyboard,A man is playing a keyboard
لا أحد يقوم بقطع الطماطم إلى شرائح,شخص ما قطع الطماطم,2,3.9,Someone is slicing a tomato,Nobody is slicing a tomato
رجل يتحدث الى امرأة,رجل يكسر البيض ,0,1.8,A man is cracking eggs,A man is talking to a woman
راكبو الدراجات الترابية يركبون على ممر,شخصان يركبان دراجات نارية,0,3.6,Two people are riding motorbikes,Dirt bikers are riding on a trail
الرجل لا يعزف على الجيتار بشكل مكثف,الرجل يعزف على الجيتار بشكل مكثف,0,3.7,The man is intensely playing the guitar,The intense man is a guitar player
يتم عزف  الفلوت من قبل المرأة,المرأة تعزف على الفلوت ,1,4.9,The woman is playing the flute,The flute is being played by the woman
رجل يركب الحصان,حصان يقوده رجل,1,5.0,A horse is being ridden by a man,A man is riding a horse
الرجل الملتحي يجلس على متن قطار,رجل يجلس في قطار ويضع يده على وجهه,0,3.8,A man is sitting on a train and resting his hand against his face,The bearded man is sitting on a train
الحيوان ذو العيون الكبيرة يأكل,الحيوان ذو العيون الكبيرة يأكل بنهم,1,4.4,The animal with big eyes is voraciously eating,The animal with big eyes is eating
شخص ما يفكك البيانو,شخص ما يعزف على الجيتار,0,2.2,Someone is playing the guitar,Someone is dismantling a piano
المصفقون لا يتجولون ولا يرتدون الزي الرسمي الأسود والوردي والأبيض,مجموعة كبيرة من المشجعين يسيرون في موكب,0,3.5,A large group of cheerleaders is walking in a parade,"The cheerleaders are not parading and are not wearing black, pink and white uniforms"
عدد قليل من النساء يرقصن,ثلاث نساء يرقصن,1,4.6,Three women are dancing,A few women are dancing
رجل يشطف شريحة لحم كبيرة,لا أحد يغسل شريحة لحم بالماء,2,3.8,Nobody is rinsing a steak with water,A man is rinsing a large steak
وقالت امرأة أنها قطعت البصل,امرأة  لم تقطع الثوم,0,3.0,A woman is slicing garlic,A woman is cutting an onion
يتم طرد  شخص من قبل قرد,قرد ركل شخصاً,1,4.9,A monkey is kicking a person,A person is being kicked by a monkey
رجل يمارس الرياضة,فتاة تتمشى ,0,1.2,The girl is lounging,A man is exercising
صبي يرتدي اللون الأزرق يهرب من امرأة ترتدي اللون الأزرق,صبي صغير يلعب في الحديقة مع والدته,0,3.3,A boy of young age is playing in the park with his mother,A boy in blue is running away from a woman in blue
الرجل لا يسيرون على طول الطريق من خلال البرية,رجل يمشي على الطريق,0,3.7,A man is walking down a road,The man is not walking along a path through the wilderness
رجل يقود سيارة,رجل يقود سيارة بعناية,1,4.6,The man is driving a car carefully,The man is driving a car
فتاة مع حقيبة سوداء هي في قطار مزدحم,ليس هناك فتاة مع حقيبة سوداء في قطار مزدحم,2,3.7,There is no girl with a black bag on a crowded train,A girl with a black bag is on a crowded train
شاب يتحدث إلى ورقة,صبي يتحدث إلى ورقة,1,4.4,A boy is talking to a leaf,A young man is talking to a leaf
الكلب يجري عبر الحصى,لا يوجد كلب صغير يركض على الرمال,0,3.2,No little dog is running on the sand,The dog is running across the gravel
شخص يرتدي زي موتوكروس يرتدي خوذة ويركب دراجة نارية حمراء,يطرق الكلب صبيًا في الماء,0,1.0,A boy is being knocked into the water by the dog,A person in a motocross uniform is wearing a helmet and rides a red motorcycle
رجل يقرأ البريد الإلكتروني,ليس هناك رجل يقرأ البريد الإلكتروني,2,3.365,There is no man reading the email,A man is reading the email
الرجل يعزف على الفلوت,رجل يعزف على الناي المصنوعة من الخيزران,1,4.1,A man is playing a flute made of bamboo,The man is playing a flute
شخص  يقطع البصل,الشخص قطع  البصل إلى قطع,1,4.7,A person is cutting an onion into pieces,A person is dicing an onion
يسير الرجل على طريق في البرية ,يسير الرجل في طريق في البرية,1,4.7,The man is walking along a path through the wilderness,The man is walking along a track through the wilderness
كان هناك طفل صغير  عاري وعابس ,صبي صغير يرتدي قميصا أصفر يضحك على الشاطئ,0,2.6,A small boy in a yellow shirt is laughing on the beach,A little boy is topless and is serious
طفل يضحك و يزحف,رجل يعزف على الكمان,0,1.1,A man is playing a violin,The baby is laughing and crawling
وليس هناك رجل يعزف على الغيتار,رجل يفتح علبة بسكين,0,1.0,A man is opening a box with a knife,There is no man playing a guitar
الأنثى الشابة ترقص,فتاة صغيرة تقف على ساق واحدة,0,3.3,A young girl is standing on one leg,A young female is dancing
الشاب لا يتسلق الصخور,رجل يرتدي قبعة أرجوانية يتسلق جدارًا صخريًا بيده العاريتان,0,3.3,A man in a purple hat is climbing a rocky wall with bare hands,The young man is not rock climbing
يلعب كلب البني والأبيض على العشب,يلعب كلب البني والأبيض على العشب,1,4.7,A brown and white dog is playing on the grass,A brown and white dog is playing on the lawn
وحيد القرن ، وهو صغير ، يتبع وحيد القرن البالغ,وحيد القرن الصغير يتجول حول قلم مع والدته,1,4.2,A baby rhino is walking around a pen with its mother,"A rhino, which is little, is following an adult rhino"
رجل يجلس على الكرسي,رجل واحد يجلس بثبات على الكرسي,1,4.4,One man is sitting steadily on the chair,One man is sitting on the chair
لا يوجد رجل يضخ الماء في فم كلب أبيض بمسدس رش,رجل يرش معتادًا على الثمالة في فم كلب,2,3.1,A man is spraying a super soaker into the mouth of a dog,There is no man squirting water into the mouth of a white dog with a squirt gun
صبي يعزف على آلة النفخ,فتاة تعزف على الفلوت,0,3.1,A girl is playing a flute,A boy is playing a wind instrument
كلب صغير يستلقي على السرير,كلب صغير يستلقي على السرير,1,5.0,A small dog is lying on a bed,A small dog is lying on the bed
مجموعة من الأشخاص يقفون حول طاولة خلط الصوت,مجموعة من الأشخاص لا يقفون حول طاولة خلط الصوت,2,3.1,A group of people are not standing around a sound mixing table,A group of people are standing around a sound mixing table
امرأة تقطع بصلة,لم تقطع المرأة البصل,2,4.3,There is no woman slicing an onion,A woman is slicing an onion
امرأة وضع أسياخ على الرف,امرأة تتخذ البيض من وعاء,0,1.9,A woman is taking eggs out of a bowl,A woman is placing skewers onto a rack
وقالت امرأة  وضع وعاء مع وجود صدع قرب بيضة,المرأة كسرت اثنين من البيض في وعاء زجاجي,0,3.0,The woman is cracking two eggs into a glass bowl,A woman is placing a bowl with a crack near an egg
رجلان يأخذان استراحة من البناء,رجلان لا يأخذان استراحة من البناء,2,3.4,Two men are not taking a break from construction,Two men are taking a break from construction
لا أحد يقاتلفي مراعي الأبقار,رجلين يتقاتلون في مراعي الأبقار,2,3.7,Two men are fighting in a cow pasture,Nobody is fighting in a cow pasture
المرأة ترقص والرجل يعزف على لوحة المفاتيح,امرأة ترقص والرجل يلعب على لوحة المفاتيح,1,4.9,A woman is dancing and a man is playing the keyboard,The woman is dancing and a man is playing the keyboard
 راكب دراجة نارية  يقفز في الهواء وحيداَ,لا أحد يقفزمن الدراجة النارية,2,4.2,There is no biker jumping in the air,A lone biker is jumping in the air
امرأة تحرك  أصابعها على الطاولة,امرأة تحرك  أصابعها على مكتبي,1,4.2,A woman is tapping her fingers on a desk,A woman is tapping her fingers on a table
امرأة ترقص على خشبة المسرح,امرأة ترقص ورجل يكتب على لوحة المفاتيح,0,3.4,A woman is dancing and a man is playing the keyboard,A woman is dancing on a stage
كلبين يركضان ويحملان شيئاً في أفواههم,كلبين يركضان ويحملان شيئاً في أفواههم,1,4.3,Two dogs are running and carrying a toy in their mouths,Two dogs are running and carrying an object in their mouths
كثير من الناس في حديقة تزلج على الجليد,حلبة التزلج على الجليد الموضوعة في الهواء الطلق مليئة بالناس,1,4.5,An ice skating rink placed outdoors is full of people,A lot of people are in an ice skating park
الرجل يضع بعض الزيت على الطماطم (البندورة),يتم سكب بعض الزيت على الطماطم (البندورة) من قبل الرجل,1,4.8,Some oil is being poured on the tomatoes by the man,The man is pouring some oil on the tomatoes
وكانت طائرة تطير,كلب ينبح بصخب,0,1.0,A dog is barking noisily,A jet is flying
رافعة بيضاء كبيرة تحلق بالقرب من الماء,يتم سقي الأرض بالقرب من طائر أبيض بسرعة,0,2.2,The land near a white bird is being watered swiftly,A large white crane is flying near the water
الرجال يحزمون الحقائب في صندوق سيارة,الرجال لا يضعون حقائب في صندوق سيارة,2,3.1,The men are not putting suitcases into the trunk of a car ,The men are packing suitcases into the trunk of a car
امرأة ترقص برشاقة,رجل يأكل,0,1.0,A man is eating,A woman is dancing gracefully
متزلج على الجليد ينقلب فوق كومة من الثلج,لا يوجد متزلج على الجليد يقوم بقلب كومة من الثلج,2,3.8,There is no snowboarder doing a flip over a mound of snow,A snowboarder is doing a flip over a mound of snow
